{
  "id": 1,
  "title": "Lanzamiento de nuevos servicios",
  "slug": "lanzamiento-nuevos-servicios",
  "excerpt": "Presentamos nuevas soluciones en tributaci√≥n para pymes.",
  "content_html": "<p>Contenido de ejemplo sobre el lanzamiento de nuevos servicios.</p>",
  "category": "General",
  "published_at": "2025-12-01"
}